{
  "$schema": "http://json-schema.org/draft-07/schema#",
  "$id": "MetaSchema",
  "description": "Meta-Schema for validating schemas",
  "type": "object",
  "properties": {
    "$id": {
      "type": "string"
    },
    "$schema": {
      "type": "string"
    },
    "type": {
      "type": "string",
      "enum": ["object"]
    },
    "description": {
      "type": "string"
    },
    "properties": {
      "type": "object",
      "patternProperties": {
        ".*": {
          "type": "object",
          "properties": {
            "type": {
              "type": "string",
              "enum": ["string", "number", "array"]
            },
            "description": {
              "type": "string"
            },
            "default": {
              "type": ["string", "number", "array"]
            },
            "enum": {
              "type": "array",
              "items": {
                "type": ["string", "number"]
              }
            },
            "minimum": {
              "type": "number"
            }
          },
          "required": ["type", "description", "default"],
          "additionalProperties": false
        }
      }
    },
    "required": {
      "type": "array",
      "items": {
        "type": "string"
      }
    }
  },
  "required": ["$id", "type", "description", "properties", "required"],
  "additionalProperties": false
}
