{
  "$id": "Customer",
  "type": "object",
  "description": "A customer.",
  "properties": {
    "name": {
      "type": "string",
      "description": "The name of the customer.",
      "default": ""
    },
    "address": {
      "type": "string",
      "description": "The address of the customer.",
      "default": ""
    },
    "phone": {
      "type": "string",
      "description": "The phone number of the customer.",
      "default": ""
    },
    "email": {
      "type": "string",
      "description": "The email address of the customer.",
      "default": ""
    }
  },
  "required": [
    "name",
    "address",
    "phone",
    "email"
  ]
}
