{
  "$id": "PizzaOrderItem",
  "type": "object",
  "description": "You have requested data which matches this JSON schema. You will be provided with their response in the form of natural language (email, text message, chat bot, etc). You need to analyse it and then parse it into this schema. Your output needs to be a one line JSON schema array that contains objects which match this schema. Your output must be parsable and must validate against this schema. There can be multiple objects. If you are unable to parse the message, output an array containing an object with the default values.",
  "properties": {
    "size": {
      "type": "string",
      "description": "The size of the pizza.",
      "enum": ["small", "medium", "large"],
      "default": "medium"
    },
    "sauce": {
      "type": "string",
      "description": "The type of sauce on the pizza.",
      "enum": ["tomato", "white", "bbq"],
      "default": "tomato"
    },
    "toppings": {
      "type": "array",
      "description": "The list of toppings on the pizza.",
      "items": {
        "type": "string"
      },
      "default": []
    },
    "quantity": {
      "type": "number",
      "description": "The quantity of the pizza.",
      "default": 1,
      "minimum": 1
    },
    "instructions": {
      "type": "string",
      "description": "Special instructions for the pizza.",
      "default": "null"
    }
  },
  "required": [
    "size",
    "sauce",
    "toppings",
    "quantity",
    "instructions"
  ]
}
